{
  "api_version": "0.1",
  "request_id": "TYPE-export_package",
  "context": {
    "host_instance_id": "TYPE-FIXTURE",
    "session_id": "TYPE-FIXTURE-SESSION",
    "project_id": "P1",
    "project_revision": 1,
    "scope": {
      "kind": "project",
      "data": "P1"
    },
    "scope_revision": 1
  },
  "outcome": {
    "status": "ok",
    "data": {
      "id": "TASK-FIXTURE",
      "scope": {
        "kind": "edit",
        "data": {
          "kind": "project",
          "data": "P1"
        }
      },
      "kind": "exporting",
      "state": "queued",
      "input_revision": 1,
      "progress": null,
      "result_ref": null,
      "failure": null
    }
  }
}
